id_text;document;sent_id;sentence;graphie_phrase_frequence_lettres_moyenne_sentence;graphie_phrase_variance_frequence_lettres_sentence;graphie_phrase_longueur_mots_moyenne_sentence;graphie_phrase_variance_longueur_mots_sentence;niveau_lexical_phrase_proportion_niveau_1_sentence;niveau_lexical_phrase_proportion_niveau_2_sentence;niveau_lexical_phrase_proportion_niveau_3_sentence;niveau_lexical_phrase_proportion_niveau_4_sentence;niveau_lexical_phrase_proportion_niveau_5_sentence;niveau_lexical_phrase_proportion_niveau_6_sentence;niveau_lexical_phrase_proportion_niveau_7_sentence;niveau_lexical_phrase_proportion_niveau_8_sentence;niveau_lexical_phrase_proportion_niveau_9_sentence;niveau_lexical_phrase_proportion_niveau_10_sentence;niveau_lexical_phrase_proportion_niveau_11_sentence;niveau_lexical_phrase_niveau_scolaire_moyen_sentence;richesse_lexicale_phrase_moyenne_probabilite_mots_sentence;richesse_lexicale_phrase_variance_probabilite_mots_sentence;richesse_lexicale_phrase_diversite_lemmes_sentence;adjectifs_ordinaux_phrase_nombre_adjectifs_ordinaux_sentence;adjectifs_ordinaux_phrase_proportion_adjectifs_ordinaux_sentence;flexions_verbales_phrase_diversite_temps_verbaux_sentence;flexions_verbales_phrase_proportion_ind-pst_sentence;flexions_verbales_phrase_proportion_ind-ps_sentence;flexions_verbales_phrase_proportion_ind-fut_sentence;flexions_verbales_phrase_proportion_ind-impft_sentence;flexions_verbales_phrase_proportion_subj-pst_sentence;flexions_verbales_phrase_proportion_ind-cond_sentence;flexions_verbales_phrase_proportion_inf-_sentence;flexions_verbales_phrase_proportion_ind-passe_comp_sentence;flexions_verbales_phrase_proportion_ind-passe_ant_sentence;flexions_verbales_phrase_proportion_ind-fut_ant_sentence;flexions_verbales_phrase_proportion_ind-plus_que_parf_sentence;flexions_verbales_phrase_proportion_subj-passe_sentence;flexions_verbales_phrase_proportion_cond-passe_sentence;flexions_verbales_phrase_proportion_inf_passe_sentence;flexions_verbales_phrase_diversite_systemes_temps_sentence;flexions_verbales_phrase_passe_sentence;flexions_verbales_phrase_present_sentence;flexions_verbales_phrase_futur_sentence;flexions_verbales_phrase_proportion_temps_compose_sentence;flexions_verbales_phrase_proportion_temps_simple_sentence;flexions_verbales_phrase_proportion_indicatif_sentence;flexions_verbales_phrase_proportion_subjonctif_sentence;flexions_verbales_phrase_proportion_infinitif_sentence;flexions_verbales_phrase_proportion_flexions_1e_personne_sentence;flexions_verbales_phrase_proportion_flexions_2e_personne_sentence;flexions_verbales_phrase_proportion_flexions_3e_personne_sentence;flexions_verbales_phrase_proportion_flexions_singulier_sentence;flexions_verbales_phrase_proportion_flexions_pluriel_sentence;parties_du_discours_phrase_proportion_ADJ_sentence;parties_du_discours_phrase_proportion_ADP_sentence;parties_du_discours_phrase_proportion_ADV_sentence;parties_du_discours_phrase_proportion_AUX_sentence;parties_du_discours_phrase_proportion_CCONJ_sentence;parties_du_discours_phrase_proportion_DET_sentence;parties_du_discours_phrase_proportion_INTJ_sentence;parties_du_discours_phrase_proportion_NOUN_sentence;parties_du_discours_phrase_proportion_NUM_sentence;parties_du_discours_phrase_proportion_PART_sentence;parties_du_discours_phrase_proportion_PRON_sentence;parties_du_discours_phrase_proportion_PROPN_sentence;parties_du_discours_phrase_proportion_PUNCT_sentence;parties_du_discours_phrase_proportion_SCONJ_sentence;parties_du_discours_phrase_proportion_SYM_sentence;parties_du_discours_phrase_proportion_VERB_sentence;parties_du_discours_phrase_proportion_X_sentence;pronoms_phrase_repartition_pronoms_personnels_1e_personne_sentence;pronoms_phrase_repartition_pronoms_personnels_2e_personne_sentence;pronoms_phrase_repartition_pronoms_personnels_3e_personne_sentence;pronoms_phrase_repartition_pronoms_personnels_singuliers_sentence;pronoms_phrase_repartition_pronoms_personnels_pluriels_sentence;pronoms_phrase_proportion_pronoms_personnels_1e_personne_sentence;pronoms_phrase_proportion_pronoms_personnels_2e_personne_sentence;pronoms_phrase_proportion_pronoms_personnels_3e_personne_sentence;pronoms_phrase_proportion_pronoms_personnels_sentence;pronoms_phrase_proportion_pronoms_personnels_singuliers_sentence;pronoms_phrase_proportion_pronoms_personnels_pluriels_sentence;pronoms_phrase_proportion_pronoms_relatifs_sentence;pronoms_phrase_proportion_pronoms_interrogatifs_sentence;pronoms_phrase_proportion_pronoms_demonstratifs_sentence;pronoms_phrase_proportion_pronoms_possessifs_sentence;pronoms_phrase_proportion_pronoms_negatifs_sentence;pronoms_phrase_nombre_pronoms_indefinis_sentence;pronoms_phrase_proportion_pronoms_indefinis_sentence;pluriels_phrase_nombre_pluriels_sentence;pluriels_phrase_proportion_pluriels_sentence;phonetique_phrase_frequence_phonemes_phrase_sentence;phonetique_phrase_frequence_phonemes_moyenne_sentence;phonetique_phrase_frequence_phonemes_variance_sentence;phonetique_phrase_diversite_phonemes_moyenne_sentence;phonetique_phrase_diversite_phonemes_variance_sentence;phonetique_phrase_nombre_phonemes_moyen_sentence;phonetique_phrase_nombre_phonemes_variance_sentence;adverbiaux_temporels_phrase_nombre_adverbiaux_temporels_sentence;adverbiaux_temporels_phrase_nombre_adverbiaux_localisation_temporelle_sentence;adverbiaux_temporels_phrase_nombre_adverbiaux_purement_duratifs_sentence;adverbiaux_temporels_phrase_nombre_adverbiaux_purement_iteratifs_sentence;adverbiaux_temporels_phrase_nombre_adverbiaux_duratifs_iteratifs_sentence;adverbiaux_temporels_phrase_nombre_adverbiaux_date_duree_sentence;adverbiaux_temporels_phrase_nombre_adverbiaux_pointage_absolu_sentence;adverbiaux_temporels_phrase_nombre_adverbiaux_pointage_non_absolu_sentence;adverbiaux_temporels_phrase_nombre_adverbiaux_loc_temp_focalisation_id_sentence;adverbiaux_temporels_phrase_nombre_adverbiaux_loc_temp_focalisation_non_id_sentence;adverbiaux_temporels_phrase_nombre_adverbiaux_loc_temp_deplacement_id_sentence;adverbiaux_temporels_phrase_nombre_adverbiaux_loc_temp_deplacement_non_id_sentence;adverbiaux_temporels_phrase_nombre_adverbiaux_loc_temp_regionalisation_id_sentence;adverbiaux_temporels_phrase_nombre_adverbiaux_loc_temp_regionalisation_non_id_sentence;adverbiaux_temporels_phrase_nombre_adverbiaux_loc_temp_pointage_absolu_sentence;adverbiaux_temporels_phrase_nombre_adverbiaux_loc_temp_pointage_non_absolu_sentence;adverbiaux_temporels_phrase_nombre_adverbiaux_iterateur_calendaire_sentence;adverbiaux_temporels_phrase_nombre_adverbiaux_iterateur_frequentiel_sentence;adverbiaux_temporels_phrase_nombre_adverbiaux_iterateur_quantificationnel_sentence;adverbiaux_temporels_phrase_nombre_adverbiaux_dur_iter_absolu_sentence;adverbiaux_temporels_phrase_nombre_adverbiaux_dur_iter_anaphorique_sentence;adverbiaux_temporels_phrase_nombre_adverbiaux_dur_iter_deictique_sentence;adverbiaux_temporels_phrase_nombre_adverbiaux_dur_iter_relatif_sentence;adverbiaux_temporels_phrase_proportion_adverbiaux_temporels_sentence;adverbiaux_temporels_phrase_proportion_adverbiaux_localisation_temporelle_sentence;adverbiaux_temporels_phrase_proportion_adverbiaux_purement_duratifs_sentence;adverbiaux_temporels_phrase_proportion_adverbiaux_purement_iteratifs_sentence;adverbiaux_temporels_phrase_proportion_adverbiaux_duratifs_iteratifs_sentence;adverbiaux_temporels_phrase_proportion_adverbiaux_date_duree_sentence;adverbiaux_temporels_phrase_proportion_adverbiaux_pointage_absolu_sentence;adverbiaux_temporels_phrase_proportion_adverbiaux_pointage_non_absolu_sentence;adverbiaux_temporels_phrase_proportion_adverbiaux_loc_temp_focalisation_id_sentence;adverbiaux_temporels_phrase_proportion_adverbiaux_loc_temp_focalisation_non_id_sentence;adverbiaux_temporels_phrase_proportion_adverbiaux_loc_temp_deplacement_id_sentence;adverbiaux_temporels_phrase_proportion_adverbiaux_loc_temp_deplacement_non_id_sentence;adverbiaux_temporels_phrase_proportion_adverbiaux_loc_temp_regionalisation_id_sentence;adverbiaux_temporels_phrase_proportion_adverbiaux_loc_temp_regionalisation_non_id_sentence;adverbiaux_temporels_phrase_proportion_adverbiaux_loc_temp_pointage_absolu_sentence;adverbiaux_temporels_phrase_proportion_adverbiaux_loc_temp_pointage_non_absolu_sentence;adverbiaux_temporels_phrase_proportion_adverbiaux_iterateur_calendaire_sentence;adverbiaux_temporels_phrase_proportion_adverbiaux_iterateur_frequentiel_sentence;adverbiaux_temporels_phrase_proportion_adverbiaux_iterateur_quantificationnel_sentence;adverbiaux_temporels_phrase_proportion_adverbiaux_dur_iter_absolu_sentence;adverbiaux_temporels_phrase_proportion_adverbiaux_dur_iter_anaphorique_sentence;adverbiaux_temporels_phrase_proportion_adverbiaux_dur_iter_deictique_sentence;adverbiaux_temporels_phrase_proportion_adverbiaux_dur_iter_relatif_sentence;emotions_phrase_score_de_polarite_sentence;emotions_phrase_score_de_subjectitvite_sentence;emotions_phrase_neutre_sentence;emotions_phrase_admiration_sentence;emotions_phrase_amour_sentence;emotions_phrase_apaisement_sentence;emotions_phrase_audace_sentence;emotions_phrase_colere_sentence;emotions_phrase_comportement_sentence;emotions_phrase_culpabilite_sentence;emotions_phrase_degout_sentence;emotions_phrase_deplaisir_sentence;emotions_phrase_desir_sentence;emotions_phrase_embarras_sentence;emotions_phrase_empathie_sentence;emotions_phrase_fierte_sentence;emotions_phrase_impassibilite_sentence;emotions_phrase_inhumanite_sentence;emotions_phrase_jalousie_sentence;emotions_phrase_joie_sentence;emotions_phrase_mepris_sentence;emotions_phrase_non_specifiee_sentence;emotions_phrase_orgueil_sentence;emotions_phrase_peur_sentence;emotions_phrase_ressentiment_sentence;emotions_phrase_surprise_sentence;emotions_phrase_tristesse_sentence;connecteurs_organisateurs_phrase_nombre_organisateurs_temporels_sentence;connecteurs_organisateurs_phrase_proportion_organisateurs_temporels_sentence;connecteurs_organisateurs_phrase_nombre_changements_de_topicalisation_sentence;connecteurs_organisateurs_phrase_proportion_changements_de_topicalisation_sentence;connecteurs_organisateurs_phrase_nombre_illustration_et_exemplification_sentence;connecteurs_organisateurs_phrase_proportion_illustration_et_exemplification_sentence;connecteurs_organisateurs_phrase_nombre_additifs_et_integration_lineaire_sentence;connecteurs_organisateurs_phrase_proportion_additifs_et_integration_lineaire_sentence;connecteurs_organisateurs_phrase_nombre_argumentatifs_et_concessifs_sentence;connecteurs_organisateurs_phrase_proportion_argumentatifs_et_concessifs_sentence;connecteurs_organisateurs_phrase_nombre_connecteurs_temporels_sentence;connecteurs_organisateurs_phrase_proportion_connecteurs_temporels_sentence;connecteurs_organisateurs_phrase_nombre_explicatifs_et_justificatifs_sentence;connecteurs_organisateurs_phrase_proportion_explicatifs_et_justificatifs_sentence;entites_nommees_phrase_proportion_entites_nommees_sentence;entites_nommees_phrase_proportion_personnes_sentence;entites_nommees_phrase_proportion_lieux_sentence;entites_nommees_phrase_proportion_organisations_sentence;entites_nommees_phrase_proportion_autres_entites_sentence;propositions_subordonnees_phrase_nombre_subordonnees_type_savoir_que_sentence;propositions_subordonnees_phrase_proportion_subordonnees_type_savoir_que_sentence;propositions_subordonnees_phrase_nombre_subordonnees_type_savoir_que_negation_sentence;propositions_subordonnees_phrase_proportion_subordonnees_type_savoir_que_negation_sentence;propositions_subordonnees_phrase_nombre_subordonnees_type_croire_que_present_sentence;propositions_subordonnees_phrase_proportion_subordonnees_type_croire_que_present_sentence;propositions_subordonnees_phrase_nombre_subordonnees_type_savoir_si_sentence;propositions_subordonnees_phrase_proportion_subordonnees_type_savoir_si_sentence;propositions_subordonnees_phrase_nombre_subordonnees_avant_apres_sentence;propositions_subordonnees_phrase_proportion_subordonnees_avant_apres_sentence;propositions_subordonnees_phrase_nombre_subordonnees_gerondif_sentence;propositions_subordonnees_phrase_proportion_subordonnees_gerondif_sentence;metaphores_phrase_nombre_metaphores_min_2_mots_sentence;metaphores_phrase_proportion_metaphores_min_2_mots_sentence;modalite_phrase_nombre_marqueurs_sentence;modalite_phrase_nombre_alethique_sentence;modalite_phrase_nombre_appreciatif_sentence;modalite_phrase_nombre_axiologique_sentence;modalite_phrase_nombre_boulique_sentence;modalite_phrase_nombre_deontique_sentence;modalite_phrase_nombre_epistemique_sentence;modalite_phrase_nombre_pas_d_indication_sentence;modalite_phrase_nombre_marqueurs_niveau3_sentence;modalite_phrase_nombre_marqueurs_niveau2_sentence;modalite_phrase_nombre_marqueurs_niveau1_sentence;modalite_phrase_nombre_marqueurs_niveau0_sentence;modalite_phrase_nombre_alethique_niveau3_sentence;modalite_phrase_nombre_alethique_niveau2_sentence;modalite_phrase_nombre_alethique_niveau1_sentence;modalite_phrase_nombre_alethique_niveau0_sentence;modalite_phrase_nombre_appreciatif_niveau3_sentence;modalite_phrase_nombre_appreciatif_niveau2_sentence;modalite_phrase_nombre_appreciatif_niveau1_sentence;modalite_phrase_nombre_appreciatif_niveau0_sentence;modalite_phrase_nombre_axiologique_niveau3_sentence;modalite_phrase_nombre_axiologique_niveau2_sentence;modalite_phrase_nombre_axiologique_niveau1_sentence;modalite_phrase_nombre_axiologique_niveau0_sentence;modalite_phrase_nombre_boulique_niveau3_sentence;modalite_phrase_nombre_boulique_niveau2_sentence;modalite_phrase_nombre_boulique_niveau1_sentence;modalite_phrase_nombre_boulique_niveau0_sentence;modalite_phrase_nombre_deontique_niveau3_sentence;modalite_phrase_nombre_deontique_niveau2_sentence;modalite_phrase_nombre_deontique_niveau1_sentence;modalite_phrase_nombre_deontique_niveau0_sentence;modalite_phrase_nombre_epistemique_niveau3_sentence;modalite_phrase_nombre_epistemique_niveau2_sentence;modalite_phrase_nombre_epistemique_niveau1_sentence;modalite_phrase_nombre_epistemique_niveau0_sentence;modalite_phrase_nombre_pas_d_indication_niveau3_sentence;modalite_phrase_nombre_pas_d_indication_niveau2_sentence;modalite_phrase_nombre_pas_d_indication_niveau1_sentence;modalite_phrase_nombre_pas_d_indication_niveau0_sentence;modalite_phrase_proportion_marqueurs_sentence;modalite_phrase_proportion_alethique_sentence;modalite_phrase_proportion_appreciatif_sentence;modalite_phrase_proportion_axiologique_sentence;modalite_phrase_proportion_boulique_sentence;modalite_phrase_proportion_deontique_sentence;modalite_phrase_proportion_epistemique_sentence;modalite_phrase_proportion_pas_d_indication_sentence;modalite_phrase_proportion_marqueurs_niveau3_sentence;modalite_phrase_proportion_marqueurs_niveau2_sentence;modalite_phrase_proportion_marqueurs_niveau1_sentence;modalite_phrase_proportion_marqueurs_niveau0_sentence;modalite_phrase_proportion_alethique_niveau3_sentence;modalite_phrase_proportion_alethique_niveau2_sentence;modalite_phrase_proportion_alethique_niveau1_sentence;modalite_phrase_proportion_alethique_niveau0_sentence;modalite_phrase_proportion_appreciatif_niveau3_sentence;modalite_phrase_proportion_appreciatif_niveau2_sentence;modalite_phrase_proportion_appreciatif_niveau1_sentence;modalite_phrase_proportion_appreciatif_niveau0_sentence;modalite_phrase_proportion_axiologique_niveau3_sentence;modalite_phrase_proportion_axiologique_niveau2_sentence;modalite_phrase_proportion_axiologique_niveau1_sentence;modalite_phrase_proportion_axiologique_niveau0_sentence;modalite_phrase_proportion_boulique_niveau3_sentence;modalite_phrase_proportion_boulique_niveau2_sentence;modalite_phrase_proportion_boulique_niveau1_sentence;modalite_phrase_proportion_boulique_niveau0_sentence;modalite_phrase_proportion_deontique_niveau3_sentence;modalite_phrase_proportion_deontique_niveau2_sentence;modalite_phrase_proportion_deontique_niveau1_sentence;modalite_phrase_proportion_deontique_niveau0_sentence;modalite_phrase_proportion_epistemique_niveau3_sentence;modalite_phrase_proportion_epistemique_niveau2_sentence;modalite_phrase_proportion_epistemique_niveau1_sentence;modalite_phrase_proportion_epistemique_niveau0_sentence;modalite_phrase_proportion_pas_d_indication_niveau3_sentence;modalite_phrase_proportion_pas_d_indication_niveau2_sentence;modalite_phrase_proportion_pas_d_indication_niveau1_sentence;modalite_phrase_proportion_pas_d_indication_niveau0_sentence;dependances_syntaxiques_phrase_profondeur_arbre_syntaxique_sentence;dependances_syntaxiques_phrase_distance_max_dependances_sentence;dependances_syntaxiques_phrase_distance_moyenne_dependances_sentence;dependances_syntaxiques_phrase_point_distance_moyenne_sentence;dependances_syntaxiques_phrase_point_distance_variance_sentence;dependances_syntaxiques_phrase_nombre_moyen_dependances_sentence;dependances_syntaxiques_phrase_variance_nombre_dependances_sentence;structures_passives_phrase_nombre_structures_passives_sentence;structures_passives_phrase_proportion_structures_passives_sur_verbes_sentence;structures_syntaxiques_phrase_nombre_subordonnees_qui_sentence;structures_syntaxiques_phrase_proportion_subordonnees_qui_sentence;structures_syntaxiques_phrase_nombre_subordonnees_que_sentence;structures_syntaxiques_phrase_proportion_subordonnees_que_sentence;structures_syntaxiques_phrase_nombre_subordonnees_prep_lequel_sentence;structures_syntaxiques_phrase_proportion_subordonnees_prep_lequel_sentence;structures_syntaxiques_phrase_nombre_subordonnees_dont_sentence;structures_syntaxiques_phrase_proportion_subordonnees_dont_sentence;structures_syntaxiques_phrase_nombre_subordonnees_completives_sentence;structures_syntaxiques_phrase_proportion_subordonnees_completives_sentence;structures_syntaxiques_phrase_nombre_subordonnees_hypothetiques_sentence;structures_syntaxiques_phrase_proportion_subordonnees_hypothetiques_sentence;structures_syntaxiques_phrase_nombre_subordonnees_gerondif_sentence;structures_syntaxiques_phrase_proportion_subordonnees_gerondif_sentence;structures_syntaxiques_phrase_nombre_incises_sentence;structures_syntaxiques_phrase_proportion_incises_sentence;structures_syntaxiques_phrase_nombre_propositions_coordonnees_sentence;structures_syntaxiques_phrase_proportion_propositions_coordonnees_sentence;superlatifs_inferiorite_phrase_nombre_superlatifs_inferiorite_sentence;superlatifs_inferiorite_phrase_proportion_superlatifs_inferiorite_sentence
0;/Users/cp/brainstorm/evalang/evalang-public/tcof/rawtextchi/long/chi_Marie_5.03.txt;0;"je sais faire des dessins moi
une maison
moi des fois quand je fais  des maisons j'appuie trop sur le feutre
ça fait des points
en plus c'est des feutres  de la garderie des fois
et des fois c'est ma maîtresse elle s'appelle Catherine
aussi des fois
à l'école euh
il y a  deux euh des fois à l'école
deux euh
il y a  par exemple
si il y avait  hum un seul euh côté
eh ben
on pourrait dessiner eh ben à l'école c'est pareil
des fois ils  mettent /des deux/ deux bouchons comme ça
mais il y a  dessine
a un
une couleur
moi je je je mets pas /de deux/ bouchons à les feutres
je mets  pas
deux bouchons des deux côtés même si c'est
bah si j'en mets moi
bah oui
oui c'est les fenêtres et là c'est la porte
bah oui c'est normal des maisons ça a un grand toit
euh non  mais bon j'en
moi des fois j'en fais des petites  et j'en fais des grosses des fois
euh ouais il y en
je tu sais pourquoi je fais  des petites fenêtres ?";0.0920848982;1.8146008713;3.3971962617;213.9460703624;0.0934579439;0.0373831776;0.1822429907;0.0887850467;0.0280373832;0.0280373832;0;0.0046728972;0.0093457944;0;0.5280373832;7.308411215;-3.24389935;1.2056012305;0;0;0;4;85.7142857143;0;0;3.5714285714;0;3.5714285714;7.1428571429;0;0;0;0;0;0;0;3;3.5714285714;92.8571428571;3.5714285714;100;0;92.8571428571;0;7.1428571429;38.4615384615;0;61.5384615385;96.1538461538;3.8461538462;0.046728972;0.0794392523;0.046728972;0.0327102804;0.023364486;0.1495327103;0.0420560748;0.1728971963;0.0327102804;0;0.2242990654;0.0046728972;0.0046728972;0.0186915888;0.0186915888;0.0981308411;0.0093457944;0.4864864865;0.027027027;0.4864864865;0.9615384615;0.0384615385;0.0841121495;0.0046728972;0.0841121495;0.1728971963;0.1168224299;0.0046728972;0;0;0.046728972;0;0;17;0.0794392523;54;0.2523364486;6.2;3.613167316;4.7284945413;0.9728354978;0.0193296017;2.5045454545;1.968161157;6;0;0;6;0;0;0;0;0;0;0;0;0;0;0;0;0;0;6;0;0;0;0;6;0;0;1;0;0;0;0;0;0;0;0;0;0;0;0;0;0;1;0;0;0;0;0.0827777778;0.0827777778;1;0;0;0;0;0;0;0;0;0;0;0;0;0;0;0;0;0;0;0;0;0;0;0;0;0;0;0;0;2;2;4;4;4;4;1;1;3;3;0.0046728972;0.0046728972;0;0;0;0;0;0;0;0;0;0;0;0;0;0;0;0;0;;;;;;;;;;;;;;;;;;;;;;;;;;;;;;;;;;;;;;;;;;;;;;;;;;;;;;;;;;;;;;;;;;;;;;;;;;;;;;;;;1;44;3.0859728507;0.8081430008;3.0017460497;0.963800905;3.202309535;0;0;0;0;0;0;0;0;0;0;4;4;3;3;0;0;11;11;4;4;0;0
0;/Users/cp/brainstorm/evalang/evalang-public/tcof/rawtextchi/long/chi_Marie_5.03.txt;1;"pour que il y ait
eh ben pour les fenêtres
bah oui faut plein de place  pour les fenêtres
bah oui c'est vrai
dans la maison il y en  a pas plusieurs
mais c'est pas grave
c'est normal c'est des dessins que je fais
alors les papillons ça c'est un peu dur pour les ailes
parce que  pas très bien les faire alors
et je fais  des petites
oui pour les papillons
et sauf que ça a des grosses ailes mais moi je fais
moi j'arrête pas de faire  ailes pour les papillons
bah oui
ah la la j'en ai plein partout
ouais je sais  a
euh je f- je fais  un papillon
ça c'est bien ça c'est le
c'est là je suis  les ailes ça c'est bien ?";0.1462376602;2.9510375811;3.4565217391;137.9134236048;0.0652173913;0.0144927536;0.2246376812;0.1376811594;0.0724637681;0.0652173913;0;0;0.0072463768;0;0.4130434783;6.6811594203;-3.1315951304;0.8222548742;0;0;0;4;82.6086956522;0;0;0;0;0;8.6956521739;4.347826087;0;0;0;0;0;0;2;4.347826087;91.3043478261;0;91.3043478261;4.347826087;86.9565217391;0;8.6956521739;38.0952380952;0;61.9047619048;100;0;0.0579710145;0.0797101449;0.115942029;0.0797101449;0.0289855072;0.1086956522;0.0507246377;0.115942029;0;0;0.2536231884;0;0.0144927536;0.0217391304;0;0.0869565217;0;0.5789473684;0;0.4210526316;0.9333333333;0.0666666667;0.0797101449;0;0.0579710145;0.1376811594;0.1014492754;0.0072463768;0.0072463768;0;0.1014492754;0;0;10;0.0724637681;25;0.1811594203;2.3966666667;3.8515736715;4.4164769577;0.9869565217;0.0021970174;2.6884057971;1.7362423861;0;0;0;0;0;0;0;0;0;0;0;0;0;0;0;0;0;0;0;0;0;0;0;0;0;0;0;0;0;0;0;0;0;0;0;0;0;0;0;0;0;0;0;0;0;0;0.0361666667;0;1;0;0;0;0;0;0;0;0;0;0;0;0;0;0;0;0;0;0;0;0;0;0;0;0;2;2;0;0;0;0;2;2;3;3;2;2;2;2;0;0;0;0;0;0;0;0;0;0;0;0;0;0;0;0;0;0;0;;;;;;;;;;;;;;;;;;;;;;;;;;;;;;;;;;;;;;;;;;;;;;;;;;;;;;;;;;;;;;;;;;;;;;;;;;;;;;;;;1;14;2.9642857143;0.6609693878;1.5295826609;0.9785714286;3.7781122449;0;0;0;0;1;1;0;0;0;0;1;1;0;0;0;0;5;5;3;3;0;0
0;/Users/cp/brainstorm/evalang/evalang-public/tcof/rawtextchi/long/chi_Marie_5.03.txt;2;"je crois
là ses cornes
bah là c'est c'est le papillon
va pas aller dans la maison
prendre du gris
oui normalement c'est en beige les fenêtres
/colorie oui/ je les  colorie
c'est pas grave /je si/ je colorie en gris en gris
va y avoir du boulot là hein
ah c'est bon j'aurai * j'aurai le temps
change de couleur
oui je prends  pas toujours la même couleur
ouais c'est pas grave si j'ai fait la maison en violet
et j'ai déjà fait le violet  là
mais je devais
le rouge je l'ai  fait là
pour les lettres
ça c'est du marron ça la vache
euh oui
* qu'est ce que c'est marqué là ?";0.1447623967;2.7660532388;3.4166666667;131.9115635522;0.0378787879;0.0454545455;0.2121212121;0.1590909091;0.0681818182;0.0303030303;0;0;0;0;0.446969697;6.8409090909;-3.3537348797;1.1781174423;0;0;0;4;64;0;0;4;0;0;12;20;0;0;0;0;0;0;2;24;76;0;80;20;88;0;12;45.4545454545;0;54.5454545455;100;0;0.0303030303;0.0606060606;0.1060606061;0.0909090909;0.0151515152;0.1060606061;0.0606060606;0.1515151515;0;0;0.2045454545;0;0.0227272727;0.0151515152;0.0303030303;0.1287878788;0;0.7857142857;0;0.2142857143;0.9230769231;0.0769230769;0.0833333333;0;0.0227272727;0.1060606061;0.0909090909;0.0075757576;0.0075757576;0.0075757576;0.0833333333;0;0;6;0.0454545455;7;0.053030303;6.2;3.9584641067;4.4841230147;0.9467866094;0.0319285455;2.7744360902;2.2047600204;1;0;0;0;1;0;0;0;0;0;0;0;0;0;0;0;0;0;0;0;0;0;0;1;0;0;0;1;0;0;0;0;0;0;0;0;0;0;0;0;0;0;0;0;0;0;0.0005882353;0.0005882353;1;0;0;0;0;0;0;0;0;0;0;0;0;0;0;0;0;0;0;0;0;0;0;0;0;0;0;0;0;0;0;1;1;2;2;0;0;2;2;0;0;0;0;0;0;0;0;0;0;0;0;0;0;0;0;0;0;0;;;;;;;;;;;;;;;;;;;;;;;;;;;;;;;;;;;;;;;;;;;;;;;;;;;;;;;;;;;;;;;;;;;;;;;;;;;;;;;;;1;28;3.1176470588;0.7761029412;2.1785200254;0.9632352941;3.3442365917;1;0.0588235294;0;0;1;1;0;0;0;0;2;2;2;2;0;0;14;14;2;2;0;0
