32;/Users/cp/brainstorm/evalang/evalang-public/tcof/rawtextchi/long/chi_Vincent_4.36.txt;6;"Léo- Léonard voit une griffure sur sa main
après c'est fini ?";1.679375;33.6085796549;4.0833333333;10.6105324074;0.0833333333;0.0833333333;0.1666666667;0.1666666667;0.0833333333;0;0;0;0;0;0.4166666667;6.4166666667;-3.89114;1.9614596419;0;0;0;2;50;0;0;0;0;0;0;50;0;0;0;0;0;0;2;50;50;0;50;50;100;0;0;0;0;100;100;0;0;0.1666666667;0;0.0833333333;0;0.1666666667;0;0.1666666667;0;0;0.0833333333;0.1666666667;0.0833333333;0;0;0.1666666667;0;0;0;0;0;0;0;0;0;0;0;0;0;0;0.0833333333;0;0;3;0.25;0;0;5.1666666667;3.0499305556;1.9634220438;0.9694444444;0.0047145062;3.4166666667;2.4097222222;0;0;0;0;0;0;0;0;0;0;0;0;0;0;0;0;0;0;0;0;0;0;0;0;0;0;0;0;0;0;0;0;0;0;0;0;0;0;0;0;0;0;0;0;0;0;0;0;1;0;0;0;0;0;0;0;0;0;0;0;0;0;0;0;0;0;0;0;0;0;0;0;0;1;1;0;0;0;0;0;0;0;0;1;1;0;0;0.1666666667;0.1666666667;0;0;0;0;0;0;0;0;0;0;0;1;1;0;0;0;0;;;;;;;;;;;;;;;;;;;;;;;;;;;;;;;;;;;;;;;;;;;;;;;;;;;;;;;;;;;;;;;;;;;;;;;;;;;;;;;;;1;9;2.3846153846;0.7692307692;1.600591716;0.8461538462;1.6686390533;0;0;0;0;0;0;0;0;0;0;0;0;0;0;0;0;0;0;0;0;0;0
32;/Users/cp/brainstorm/evalang/evalang-public/tcof/rawtextchi/long/chi_Vincent_4.36.txt;7;"Léonard pleure
et après il  fait quoi là ?";2.6128125;53.7609646362;4;6;0;0;0.125;0.375;0.125;0;0;0;0;0;0.375;6.625;-3.515360375;1.4812786592;0;0;0;1;100;0;0;0;0;0;0;0;0;0;0;0;0;0;1;0;100;0;100;0;100;0;0;0;0;100;100;0;0;0;0.25;0;0.125;0;0;0;0;0;0.25;0.125;0.125;0;0;0.25;0;0;0;1;1;0;0;0;0.125;0.125;0.125;0;0;0.125;0;0;0;1;0.125;0;0;4.2916666667;4.5525625;4.2929047843;1;0;3.25;2.4375;0;0;0;0;0;0;0;0;0;0;0;0;0;0;0;0;0;0;0;0;0;0;0;0;0;0;0;0;0;0;0;0;0;0;0;0;0;0;0;0;0;0;0;0;0;0;-0.5;-0.5;1;0;0;0;0;0;0;0;0;0;0;0;0;0;0;0;0;0;0;0;0;0;0;0;0;1;1;0;0;0;0;1;1;0;0;1;1;0;0;0.125;0.125;0;0;0;0;0;0;0;0;0;0;0;0;0;0;0;0;0;;;;;;;;;;;;;;;;;;;;;;;;;;;;;;;;;;;;;;;;;;;;;;;;;;;;;;;;;;;;;;;;;;;;;;;;;;;;;;;;;1;4;1.6666666667;0.4777777778;0.8261728395;0.7777777778;2.6172839506;0;0;0;0;0;0;0;0;0;0;0;0;0;0;0;0;0;0;1;1;0;0
32;/Users/cp/brainstorm/evalang/evalang-public/tcof/rawtextchi/long/chi_Vincent_4.36.txt;8;"ben il  caresse les genoux
il  Léonard
j'arrive pas
tu me l'as  lu déjà ?";1.1508203125;21.1074240546;3.4375;15.2614746094;0;0.0625;0.0625;0.0625;0.125;0.125;0;0;0;0;0.5625;8.125;-3.37119175;1.3877715802;0;0;0;2;66.6666666667;0;0;0;0;0;0;33.3333333333;0;0;0;0;0;0;2;33.3333333333;66.6666666667;0;66.6666666667;33.3333333333;100;0;0;33.3333333333;33.3333333333;33.3333333333;100;0;0;0;0.125;0.0625;0;0.0625;0;0.0625;0;0;0.375;0.0625;0.0625;0;0;0.1875;0.0625;0.3333333333;0.1666666667;0.5;1;0;0.125;0.0625;0.1875;0.375;0.375;0;0;0;0;0;0;1;0.0625;2;0.125;0.9333333333;4.8248958333;2.1533182183;0.9875;0.00234375;3.25;2.1875;0;0;0;0;0;0;0;0;0;0;0;0;0;0;0;0;0;0;0;0;0;0;0;0;0;0;0;0;0;0;0;0;0;0;0;0;0;0;0;0;0;0;0;0;0;0;0;0;1;0;0;0;0;0;0;0;0;0;0;0;0;0;0;0;0;0;0;0;0;0;0;0;0;0;0;0;0;0;0;0;0;0;0;0;0;0;0;0.0625;0.0625;0;0;0;0;0;0;0;0;0;0;0;0;0;0;0;0;0;;;;;;;;;;;;;;;;;;;;;;;;;;;;;;;;;;;;;;;;;;;;;;;;;;;;;;;;;;;;;;;;;;;;;;;;;;;;;;;;;1;6;2.2352941176;0.5029411765;0.9330795848;0.8823529412;3.1626297578;0;0;0;0;0;0;0;0;0;0;0;0;0;0;0;0;2;2;0;0;0;0
32;/Users/cp/brainstorm/evalang/evalang-public/tcof/rawtextchi/long/chi_Vincent_4.36.txt;9;"euh il  monte sur le lit
il  fait un bisou
* mal
comme il a pas mal il  fait un bisou sur le chouchou
sur le museau à Chouchou
* comme il a pas mal euh il est content
et Chouchou ils sont  nouveau copains
ils  à sauter et à courir
non je /lis veux/ une autre  histoire";0.3204941109;6.0585310745;3.4576271186;58.7973697408;0.1016949153;0.0677966102;0.0847457627;0.186440678;0.0338983051;0;0;0;0;0;0.5254237288;7.186440678;-3.391528339;1.5102967412;0;0;0;3;72.7272727273;0;0;0;0;0;18.1818181818;0;0;0;0;0;0;0;1;0;90.9090909091;0;90.9090909091;0;72.7272727273;0;18.1818181818;0;22.2222222222;77.7777777778;88.8888888889;11.1111111111;0.0508474576;0.1016949153;0.1016949153;0.0338983051;0.0338983051;0.1016949153;0.0508474576;0.1186440678;0;0;0.1525423729;0.0169491525;0.0169491525;0.0338983051;0.0508474576;0.1525423729;0;0.1111111111;0;0.8888888889;0.7777777778;0.2222222222;0.0169491525;0;0.1355932203;0.1525423729;0.1186440678;0.0338983051;0;0;0;0;0;10;0.1694915254;4;0.0677966102;0.3;3.8605649718;5.4796437486;0.9276836158;0.0438852182;2.7288135593;2.0281528296;0;0;0;0;0;0;0;0;0;0;0;0;0;0;0;0;0;0;0;0;0;0;0;0;0;0;0;0;0;0;0;0;0;0;0;0;0;0;0;0;0;0;0;0;0;0;0.1257142857;0.1257142857;0.8709677419;0;0.0967741935;0;0;0;0;0;0;0;0;0;0;0;0;0;0;0.0322580645;0;0;0;0;0;0;0;0;0;0;0;2;2;2;2;0;0;0;0;0;0;0.0338983051;0.0338983051;0;0;0;0;0;0;0;0;0;0;0;0;0;0;0;0;0;;;;;;;;;;;;;;;;;;;;;;;;;;;;;;;;;;;;;;;;;;;;;;;;;;;;;;;;;;;;;;;;;;;;;;;;;;;;;;;;;1;14;2.75;0.705;1.608725;0.9666666667;3.0988888889;0;0;0;0;0;0;0;0;0;0;0;0;0;0;0;0;3;3;1;1;0;0
33;/Users/cp/brainstorm/evalang/evalang-public/tcof/rawtextchi/long/chi_Hector_5.89.txt;0;"appelle  euh
une fois il existait un bon roi avec une épée mais pas une épée en bois une épée en fer comme les autres
ouais les vraies épées
bah oui
et tout le monde  allait chercher quelque chose peut-être au château
bah pour se nourrir
bah oui
des marchés
et un on fabriquait une épée en bois et beaucoup rigolaient avec son épée
ouais après il  disait
donne-moi une autre épée les épées c'est dangereux
et et il disa  la garder cette épée
ouais il veut interdit ceux qui ont
sauf lui
il  la garder
et là /prenait prenez/ son épée et maintenant  et met en prison
ouais dans un cachot
c'est le roi qui l'a jeté dans dans un ca- cachot et /prisprit/ son épée
/non oh/ tu vas voir ce qui
et le roi le regardait s'il était bien sage
qu'il sera
mais après le libéreur  est là
ouais et d- et il  disait tout à son ami
ouais il a  dit de fabriquer une épée en bois
et et et j'étais en train de jouer  avec et et le roi il est venu et il a dit donne-nous ton épée
et et auss- et et et apr- et moi je disais  la garder
a- alors lui tu sais ce qu'il  m'a jeté dans un cachot
et après tout le monde  racontait ça
non tu v- tu veux dire tout le château
ou sinon se disputaient parce que
et tout le monde  se disputait
elle gronda  une femme gronda
oh c'est le téléphone
ah ah d'acc- non  un /nouveau autre/ téléphone
hum et bah je
je je sais pas peut-être  c'est vrai et
et lui c'est p- elle voudr- et c'est pas vrai
et là hum celui  le roi
hum rendez mon épée hum non  c'est que le roi qui a une ép- qui a une épée
il dit
que les rois portent des épées
pourquoi je peux  pas être le roi à votre place
hum d'accord tu peux
et là peut-être  le roi a dit c'est
et déchirait tous les drapeaux
xxx il a nommé pendant ce temps  le roi
ouais et après déchira toutes les feuilles d- du hum de sol mais peut-être  va être plus roi
plus roi
et là il  rends cette épée
mon roi je te  rend cette épée
ben non  qu- qu'il a dit arrête et là disait nouveau garde nouveau garde
après  pour euh pour peut-être /rendre prendre/ son épée
mais mais je sais pas très bien le dire mais
ouais hum si il  peut rendre son épée
ouais bah parce que en  fait le garçon il a demandé
et renda son épée
et construis- et n- et est nommé euh construiseur  avec beaucoup de terre
il  plein d'épées en bois
et après c'est fini";0.0421724254;0.8785820502;3.6153846154;493.9735404739;0.0303643725;0.0890688259;0.1315789474;0.1599190283;0.0809716599;0.036437247;0;0;0;0;0.471659919;7.0546558704;-3.385078131;1.406179585;0;0;0;7;42.6829268293;4.8780487805;1.2195121951;19.512195122;0;0;18.2926829268;12.1951219512;0;0;0;0;0;0;3;36.5853658537;60.9756097561;1.2195121951;86.5853658537;12.1951219512;80.487804878;0;18.2926829268;13.4328358209;7.4626865672;79.1044776119;91.0256410256;8.9743589744;0.0425101215;0.0789473684;0.0971659919;0.048582996;0.0971659919;0.1133603239;0.0263157895;0.1538461538;0;0;0.1538461538;0.004048583;0.0060728745;0.016194332;0.020242915;0.1396761134;0.008097166;0.22;0.12;0.66;0.9787234043;0.0212765957;0.0222672065;0.012145749;0.0668016194;0.1012145749;0.0931174089;0.0020242915;0.0141700405;0;0.028340081;0;0;92;0.1862348178;29;0.0587044534;6.4725;4.0201759793;3.7847973728;0.9463181644;0.0267304757;2.7278225806;2.4360000976;3;2;0;0;1;0;0;3;2;0;0;0;2;0;0;2;0;0;0;0;0;1;0;3;0.6666666667;0;0;0.3333333333;0;0;1;1;0;0;0;1;0;0;1;0;0;0;0;0;1;0;0.1354166667;0.1354166667;0.9808429119;0;0.0038314176;0;0;0.0076628352;0;0;0;0;0;0;0;0;0;0;0;0.0038314176;0;0;0;0.0038314176;0;0;0;7;7;0;0;1;1;35;35;6;6;8;8;4;4;0;0;0;0;0;1;1;0;0;1;1;0;0;0;0;0;0;0;0;;;;;;;;;;;;;;;;;;;;;;;;;;;;;;;;;;;;;;;;;;;;;;;;;;;;;;;;;;;;;;;;;;;;;;;;;;;;;;;;;1;31;2.6633266533;0.8189378758;1.8707849025;0.9879759519;2.7052662439;0;0;5;5;2;2;0;0;0;0;13;13;2;2;0;0;21;21;24;24;0;0
34;/Users/cp/brainstorm/evalang/evalang-public/tcof/rawtextchi/long/chi_Marie_5.2.txt;0;"maintenant  j'ai plus qu'à faire Lili et le pinceau
et le panneau
hum du bleu foncé
il y en  a là
oui il y en  avait là
il  fait violet
oui c'est un bleu un bleu violet
du gris je veux s'il te  plaît
hum pour colorier le manche
il y en
non *
bah bah la boîte à peinture
là ça dé- ça déborde un petit   que/ là ça déborde
ouais ça doit déborder
hum c'est pas grave si ça déborde  déborde
ouais parce que  elle est jusqu'à cette taille
ça c'est du violet
et euh il a trempé le pinceau dans le dans la boîte et
et c'était du du violet qu'il  fallait faire dans la boîte
tant pis
bah oui
ouais je vais
à l'école
à l'école eh ben il y a  à l'école
euh oui l'autre jour je j'avais fait un puzzle de clown et j'ai réussi
et j'ai réussi
à le faire
oui qui allaient avec
à genoux comme ça c'est mieux
ouais xxx
j'adore le jaune doré
ouais j'adore
en plus c'est bien de
ça fait très joli quand on fait en jaune hein c'est vrai ?";0.082714549;1.477774796;3.3240740741;215.9488450535;0.0277777778;0.0324074074;0.1666666667;0.1157407407;0.0555555556;0.087962963;0;0.0046296296;0.0046296296;0;0.5046296296;7.4907407407;-3.3568834128;1.3094716512;0;0;0;5;61.1111111111;0;0;11.1111111111;0;0;13.8888888889;11.1111111111;0;0;2.7777777778;0;0;0;2;25;75;0;86.1111111111;13.8888888889;86.1111111111;0;13.8888888889;25.8064516129;0;74.1935483871;97.1428571429;2.8571428571;0.0324074074;0.0925925926;0.0833333333;0.0509259259;0.0324074074;0.1064814815;0.0555555556;0.1435185185;0;0;0.212962963;0.0046296296;0.0046296296;0.0277777778;0.0138888889;0.1342592593;0.0092592593;0.3333333333;0.037037037;0.6296296296;1;0;0.0416666667;0.0046296296;0.0787037037;0.125;0.0925925926;0;0.0138888889;0;0.0694444444;0;0;16;0.0740740741;2;0.0092592593;2.944;4.1072060944;4.3195318549;0.9724552206;0.010957464;2.7293577982;2.2891381197;1;1;0;0;0;0;0;1;1;0;0;0;1;0;0;1;0;0;0;0;0;0;0;1;1;0;0;0;0;0;1;1;0;0;0;1;0;0;1;0;0;0;0;0;0;0;0.0763333333;0.0763333333;0.9714285714;0;0.0285714286;0;0;0;0;0;0;0;0;0;0;0;0;0;0;0;0;0;0;0;0;0;0;0;0;0;0;1;1;6;6;0;0;2;2;3;3;0.0046296296;0;0;0;0.0046296296;0;0;0;0;0;0;0;0;0;0;0;0;0;0;;;;;;;;;;;;;;;;;;;;;;;;;;;;;;;;;;;;;;;;;;;;;;;;;;;;;;;;;;;;;;;;;;;;;;;;;;;;;;;;;1;68;3;0.8180147858;3.0061855525;0.9817351598;3.0681595463;0;0;1;1;2;2;0;0;0;0;4;4;2;2;0;0;13;13;4;4;0;0
34;/Users/cp/brainstorm/evalang/evalang-public/tcof/rawtextchi/long/chi_Marie_5.2.txt;1;il est il est vraiment fluo hein ?;3.3028571429;74.8036478134;3.7142857143;5.029154519;0;0;0;0.2857142857;0.1428571429;0;0;0;0;0;0.5714285714;8.1428571429;-3.4072091429;0.6835487767;0;0;0;1;100;0;0;0;0;0;0;0;0;0;0;0;0;0;1;0;100;0;100;0;100;0;0;0;0;100;100;0;0.2857142857;0;0.1428571429;0.2857142857;0;0;0;0;0;0;0.2857142857;0;0.1428571429;0;0;0;0;0;0;1;1;0;0;0;0.2857142857;0.2857142857;0.2857142857;0;0;0;0;0;0;0;0;0;0;6.2;3.1048571429;4.1796272653;1;0;2.8571428571;1.5510204082;0;0;0;0;0;0;0;0;0;0;0;0;0;0;0;0;0;0;0;0;0;0;0;0;0;0;0;0;0;0;0;0;0;0;0;0;0;0;0;0;0;0;0;0;0;0;0;0;1;0;0;0;0;0;0;0;0;0;0;0;0;0;0;0;0;0;0;0;0;0;0;0;0;0;0;0;0;0;0;0;0;0;0;0;0;0;0;0;0;0;0;0;0;0;0;0;0;0;0;0;0;0;0;0;0;0;;;;;;;;;;;;;;;;;;;;;;;;;;;;;;;;;;;;;;;;;;;;;;;;;;;;;;;;;;;;;;;;;;;;;;;;;;;;;;;;;1;6;2.625;0.3333333333;0.7777777778;0.75;3.9375;0;0;0;0;0;0;0;0;0;0;0;0;0;0;0;0;0;0;0;0;0;0
34;/Users/cp/brainstorm/evalang/evalang-public/tcof/rawtextchi/long/chi_Marie_5.2.txt;2;"ça c'est du jaune normal
ouais tu as  vu il est un peu noir
ouais  fait
ouais regarde là c'est un feutre trans- transparent
si apparemment elle serait pas noire
oui mais on a la couleur là
Clément tout à l'heure ce matin quand ben quand il avait dessiné
il avait pris les bouchons il avait mis le vert celui-là
ai remis la bonne couleur
ouah il  va tomber là
mais non du jaune doré sur du rose ça tu as  vu ça fait orange
ouais il est quand même un peu noir celui-là  il était
il était déjà noir
bon tant pis hein
j'ai pas fait du j'ai pas fait du bleu ciel
je vais
oui j- je fais  attention moi
euh ça
le panneau
Lili je vais  la colorier en en marron puisqu'elle est en marron
ouais c'est marron les castors
oh ça existe dans la télé
ouais que moi j'ai des j'ai des puzzles d'animal
ouais mais qui sont sur des pages pour de vrai
non  c'est
c'est pas des photos moi moi je fais le puzzle sur la page des sur la page hum du livre
euh il y a  des lions
non il y avait  des tigres
et et il  au au tigre
et je la  chez moi
et euh
je l'avais
pas retrouvé  le livre euh des tigres
ouais mais
je l'ai  dans ma chambre j'ai trop de jouets
eh ben qu- j'ai tellement j'ai beaucoup beaucoup de jouets que je peux  même pas les ranger
si j'ai de la  j'en ai plein
je m'applique  je m'applique très bien là
bah toi aussi";0.0663750864;1.3084638399;3.4848484848;296.9591105422;0.0572390572;0.0505050505;0.202020202;0.1043771044;0.063973064;0.0538720539;0.0033670034;0;0.0033670034;0;0.4612794613;6.9528619529;-3.3085242211;1.1300146792;0;0;0;6;63.829787234;0;0;6.3829787234;0;2.1276595745;6.3829787234;12.7659574468;0;0;8.5106382979;0;0;0;3;27.6595744681;70.2127659574;2.1276595745;78.7234042553;21.2765957447;93.6170212766;0;6.3829787234;43.1818181818;4.5454545455;52.2727272727;98.1481481481;1.8518518519;0.0404040404;0.0740740741;0.1212121212;0.0707070707;0.0269360269;0.1144781145;0.0471380471;0.1313131313;0;0;0.2154882155;0.0067340067;0;0.0269360269;0;0.1212121212;0.0033670034;0.5102040816;0.0612244898;0.4285714286;0.9787234043;0.0212765957;0.0841750842;0.0101010101;0.0707070707;0.164983165;0.1548821549;0.0033670034;0.0067340067;0;0.0404040404;0;0;31;0.1043771044;23;0.0774410774;6.95;3.8750608597;4.1076137902;0.9765205092;0.0049788618;2.8184818482;1.9769521507;1;1;0;0;0;0;0;1;1;0;0;0;1;0;0;1;0;0;0;0;0;0;0;1;1;0;0;0;0;0;1;1;0;0;0;1;0;0;1;0;0;0;0;0;0;0;0.0642857143;0.0642857143;1;0;0;0;0;0;0;0;0;0;0;0;0;0;0;0;0;0;0;0;0;0;0;0;0;0;0;0;0;0;0;4;4;7;7;3;3;3;3;0.0067340067;0.0033670034;0;0;0.0033670034;0;0;0;0;0;0;0;0;0;0;0;0;0;0;;;;;;;;;;;;;;;;;;;;;;;;;;;;;;;;;;;;;;;;;;;;;;;;;;;;;;;;;;;;;;;;;;;;;;;;;;;;;;;;;1;19;2.8052805281;0.6899274451;1.5476838868;0.9768976898;3.5341197486;0;0;1;1;1;1;0;0;0;0;3;3;2;2;0;0;23;23;5;5;0;0
35;/Users/cp/brainstorm/evalang/evalang-public/tcof/rawtextchi/long/chi_Louise_4.62.txt;0;tu as  pas de téléphone ?;3.9112;73.427930112;3.6;2.408;0;0;0.2;0.2;0.2;0;0;0;0;0;0.4;6.8;-3.0680328;0.6010181851;0;0;0;1;100;0;0;0;0;0;0;0;0;0;0;0;0;0;1;0;100;0;100;0;100;0;0;0;100;0;100;0;0;0;0.2;0;0;0.2;0;0.2;0;0;0.2;0;0.2;0;0;0.2;0;0;1;0;1;0;0;0.2;0;0.2;0.2;0;0;0;0;0;0;1;0.2;0;0;6.2;4.2347142857;4.4338346122;0.9314285714;0.0073795918;3.4;5.04;0;0;0;0;0;0;0;0;0;0;0;0;0;0;0;0;0;0;0;0;0;0;0;0;0;0;0;0;0;0;0;0;0;0;0;0;0;0;0;0;0;0;0;0;0;0;0;0;1;0;0;0;0;0;0;0;0;0;0;0;0;0;0;0;0;0;0;0;0;0;0;0;0;0;0;0;0;0;0;0;0;0;0;0;0;0;0;0;0;0;0;0;0;0;0;0;0;0;0;0;0;0;0;0;0;0;;;;;;;;;;;;;;;;;;;;;;;;;;;;;;;;;;;;;;;;;;;;;;;;;;;;;;;;;;;;;;;;;;;;;;;;;;;;;;;;;1;3;1.1666666667;0.4444444444;0.4320987654;0.6666666667;1.2222222222;0;0;0;0;0;0;0;0;0;0;0;0;0;0;0;0;0;0;0;0;0;0
35;/Users/cp/brainstorm/evalang/evalang-public/tcof/rawtextchi/long/chi_Louise_4.62.txt;1;c'est celui-  ?;6.5588888889;114.7173958848;3.6666666667;-1.4814814815;0;0;0;0.3333333333;0;0;0;0;0;0;0.6666666667;8.6666666667;-3.9785426667;2.1895573841;0;0;0;1;100;0;0;0;0;0;0;0;0;0;0;0;0;0;1;0;100;0;100;0;100;0;0;0;0;100;100;0;0;0;0;0.3333333333;0;0;0;0;0;0;0.6666666667;0;0.3333333333;0;0;0;0;0;0;0;0;0;0;0;0;0;0;0;0;0;0.6666666667;0;0;0;0;0;0;5.35;4.0033333333;3.1393555556;1;0;3.3333333333;1.5555555556;0;0;0;0;0;0;0;0;0;0;0;0;0;0;0;0;0;0;0;0;0;0;0;0;0;0;0;0;0;0;0;0;0;0;0;0;0;0;0;0;0;0;0;0;0;0;0;0;1;0;0;0;0;0;0;0;0;0;0;0;0;0;0;0;0;0;0;0;0;0;0;0;0;0;0;0;0;0;0;0;0;0;0;0;0;0;0;0;0;0;0;0;0;0;0;0;0;0;0;0;0;0;0;0;0;0;;;;;;;;;;;;;;;;;;;;;;;;;;;;;;;;;;;;;;;;;;;;;;;;;;;;;;;;;;;;;;;;;;;;;;;;;;;;;;;;;1;3;1.25;0.375;0.421875;0.5;0.75;0;0;0;0;0;0;0;0;0;0;0;0;0;0;0;0;0;0;0;0;0;0
35;/Users/cp/brainstorm/evalang/evalang-public/tcof/rawtextchi/long/chi_Louise_4.62.txt;2;"le soleil
il  dort
parce que Anaïs elle elle  elle elle a crié trop fort
il  saute sur le lit d'Anaïs
pour le  chatouiller les pieds
met elle enfile sa culotte
il  prend ses chaussettes
dans la cuisine /ils  leur/ chocolat
vois Karim qui fait des grimaces
sur sa brosse à dents
Maman elle se v- elle se lave les mains
elle elle elle prend un dessin pour son copain Karim
pour leur dire
dépêchez-vous vous allez être  en retard
pour all- l- arriver à l'école et";0.259350189;6.1874207765;3.9891304348;91.8270308519;0.1086956522;0.0326086957;0.152173913;0.0652173913;0.0652173913;0;0.0108695652;0;0;0;0.5652173913;7.5108695652;-3.529140337;1.8680727759;0;0;0;4;64.7058823529;0;0;0;0;0;23.5294117647;5.8823529412;0;0;0;0;0;0;2;5.8823529412;88.2352941176;0;88.2352941176;5.8823529412;70.5882352941;0;23.5294117647;0;23.0769230769;76.9230769231;85.7142857143;14.2857142857;0;0.1304347826;0.0326086957;0.0217391304;0.0108695652;0.1304347826;0;0.1739130435;0;0;0.2391304348;0.0543478261;0;0.0108695652;0.0217391304;0.1739130435;0;0;0.0952380952;0.9047619048;0.7368421053;0.2631578947;0;0.0217391304;0.2065217391;0.2282608696;0.152173913;0.0543478261;0.0108695652;0;0;0;0;4;0.0434782609;16;0.1739130435;5.85;4.2247518116;3.3661236338;0.9552536232;0.0242326651;2.9891304348;2.1411862004;0;0;0;0;0;0;0;0;0;0;0;0;0;0;0;0;0;0;0;0;0;0;0;0;0;0;0;0;0;0;0;0;0;0;0;0;0;0;0;0;0;0;0;0;0;0;0.205;0.205;0.9583333333;0;0.0208333333;0;0;0;0.0208333333;0;0;0;0;0;0;0;0;0;0;0;0;0;0;0;0;0;0;0;0;0;0;0;0;1;1;0;0;0;0;1;1;0.0543478261;0.0543478261;0;0;0;0;0;0;0;0;0;0;0;0;0;0;0;0;0;;;;;;;;;;;;;;;;;;;;;;;;;;;;;;;;;;;;;;;;;;;;;;;;;;;;;;;;;;;;;;;;;;;;;;;;;;;;;;;;;1;41;3.5434782609;0.9589371981;4.5434359612;0.9891304348;2.7281427221;0;0;1;1;0;0;0;0;0;0;2;2;0;0;0;0;9;9;0;0;0;0
36;/Users/cp/brainstorm/evalang/evalang-public/tcof/rawtextchi/long/chi_Sarah_5.08.txt;0;"euh écouter
le début
on pourra pas
c'est les calendriers ?";2.2763636364;56.5290698723;4.2727272727;9.3403456048;0;0.0909090909;0;0.3636363636;0.0909090909;0;0;0;0;0;0.4545454545;7.0909090909;-3.1451191818;0.692400349;0;0;0;3;33.3333333333;0;33.3333333333;0;0;0;33.3333333333;0;0;0;0;0;0;0;2;0;66.6666666667;33.3333333333;100;0;66.6666666667;0;33.3333333333;0;0;100;100;0;0;0;0.0909090909;0.0909090909;0;0.1818181818;0.0909090909;0.1818181818;0;0;0.1818181818;0;0.0909090909;0;0;0.1818181818;0;0;0;0;0;0;0;0;0;0;0;0;0;0;0.0909090909;0;0;1;0.0909090909;2;0.1818181818;0.3;3.9146212121;3.6968249197;0.9818181818;0.0033057851;3.2727272727;4.5619834711;0;0;0;0;0;0;0;0;0;0;0;0;0;0;0;0;0;0;0;0;0;0;0;0;0;0;0;0;0;0;0;0;0;0;0;0;0;0;0;0;0;0;0;0;0;0;0;0;1;0;0;0;0;0;0;0;0;0;0;0;0;0;0;0;0;0;0;0;0;0;0;0;0;0;0;0;0;0;0;0;0;0;0;0;0;0;0;0;0;0;0;0;0;0;0;0;0;0;0;0;0;0;0;0;0;0;;;;;;;;;;;;;;;;;;;;;;;;;;;;;;;;;;;;;;;;;;;;;;;;;;;;;;;;;;;;;;;;;;;;;;;;;;;;;;;;;1;6;2.1666666667;0.6041666667;0.8693576389;0.8333333333;1.8055555556;0;0;0;0;0;0;0;0;0;0;0;0;0;0;0;0;1;1;0;0;0;0
36;/Users/cp/brainstorm/evalang/evalang-public/tcof/rawtextchi/long/chi_Sarah_5.08.txt;1;"il y a  même des coloriages
et un feutre rouge
il y avait  un gros camion
une nou- u- \""Une nouvelle famille arrive à la Cité\""
il y  avait un gros camion
dans la cour
là ils  même la maman regarde par la fenêtre
et tou- et ils  font des sourires
venez vite aider xxx mes amis avec moi
venez xxx  aider mes amis a- avec moi
et là ils portent tous les pa- tous les paquets
hum et après il y a  une petite fille et une deuxième petite fille
et après une mamie qui tient qui tient xxx un bébé dans ses bras
et là le le papa sort un gros canapé
qui est très lourd
et la maman explique
que la première petite fille s'appelle Victoria
et la deuxième petite fille s'appelle Joséphine
là le bébé il  parce que il a faim
et là Jo- Joséphine a trouvé le paquet où on voit un bébé
et Victoria a trouvé le petit paquet où on voit le biberon
là ils aident à porter une la petite le euh
hum la euh
la petite valise où où il y a  les affaires de Bébé-Moïse
et là le papa cherche sa guitare
il avait oublié qu- que il l'avait mis dans le le lit de Bébé-Moïse
et la mamie avait perdu son tricot
et comment elle s'a- Victoria
Victoria a trouvé son tricot où il où il était dans la dans dans
hum hum
et là elle avait ramené un poisson
et elle a dit on va chercher son aquarium pour qu'il puisse nager dedans
et là elle a elle a trouvé une image où on voit une aquaro- un aquarium et
et elle lui a dit tu vois toi tu as  pas changé d'appartement
et là le papa a- est allé chercher du du jus de pomme
mais Bébé-Moïse ne boit pas parce qu'il a déjà bu son lait
et le
poisson non plus parce que il adore que l'eau";0.0604017301;1.2404347293;3.6735294118;339.9603093578;0.0470588235;0.0852941176;0.1529411765;0.0852941176;0.1029411765;0.0058823529;0;0;0;0;0.5205882353;7.2941176471;-3.3744143196;1.403945457;0;3;0.0088235294;6;53.8461538462;0;0;5.7692307692;0;0;11.5384615385;19.2307692308;0;0;7.6923076923;0;0;0;2;32.6923076923;65.3846153846;0;71.1538461538;26.9230769231;86.5384615385;0;11.5384615385;0;8.6956521739;91.3043478261;91.3793103448;8.6206896552;0.0558823529;0.0558823529;0.1029411765;0.0441176471;0.0676470588;0.1676470588;0.0029411765;0.1588235294;0;0;0.1352941176;0.0323529412;0.0058823529;0.0235294118;0;0.1470588235;0.0058823529;0.0512820513;0.0769230769;0.8717948718;0.8709677419;0.1290322581;0.0058823529;0.0088235294;0.1;0.1147058824;0.0794117647;0.0117647059;0.0088235294;0;0;0;0;40;0.1176470588;26;0.0764705882;6.2;4.1753461458;3.4924970339;0.9579632733;0.012360251;3.0469208211;3.4230183779;0;0;0;0;0;0;0;0;0;0;0;0;0;0;0;0;0;0;0;0;0;0;0;0;0;0;0;0;0;0;0;0;0;0;0;0;0;0;0;0;0;0;0;0;0;0;0.1601923077;0.1601923077;0.9776536313;0;0.0167597765;0;0;0;0.0055865922;0;0;0;0;0;0;0;0;0;0;0;0;0;0;0;0;0;0;2;2;0;0;0;0;21;21;3;3;2;2;4;4;0.0294117647;0.0264705882;0;0;0.0029411765;0;0;0;0;0;0;0;0;0;0;0;0;0;0;;;;;;;;;;;;;;;;;;;;;;;;;;;;;;;;;;;;;;;;;;;;;;;;;;;;;;;;;;;;;;;;;;;;;;;;;;;;;;;;;1;17;2.6793002915;0.7651603499;1.5162105359;0.9883381924;2.8978231859;0;0;3;3;0;0;0;0;0;0;8;8;0;0;0;0;16;16;17;17;0;0
37;/Users/cp/brainstorm/evalang/evalang-public/tcof/rawtextchi/long/chi_Valentine_5.56.txt;0;"euh non
crois pas
euh il y a  Bébé-Leïla qui pleure
et Karim
essaie de la consoler
il n'y arrive
Karim si elle a mal
mais Bébé-Leïla  euh elle ne sait pas encore parler
a fait pipi
mais  la couche de Bébé-Leïla elle est toute sèche
euh il appelle sa soeur
ah c'est oui c'est vrai c'est sa euh
c'est sa
parce que il n'y arrive pas à la consoler
euh elle a sûrement faim
lui donner à manger
apporte la  remplie de purée
que  avant de partir au marché
et hum
la casserole remplie de purée
elle tape  sur la table en chantant boulou boulou
euh  faut attendre un peu
elle est encore trop chaude
elle coupe les morceaux de viande dans l'assiette
elle euh elle est p- elle a pas envie de
que on lui raconte une histoire
de faire des bêtises
/lancé dans l'assiette en/ l'air
et elle rit  en voyant tous les morceaux de viande sur la table
euh  donne
une cuillère de purée euh  au bébé
de ramasser les morceaux de viande
au marché
avec un yaourt rose euh  le dessert de Bébé-Leïla";0.1147669612;2.647397003;3.8507462687;200.9262276277;0.0447761194;0.0348258706;0.1094527363;0.1691542289;0.0547263682;0.039800995;0.0099502488;0.0049751244;0;0;0.5323383085;7.5970149254;-3.3894558725;1.5605604541;0;0;0;3;72.2222222222;0;0;0;0;0;25;2.7777777778;0;0;0;0;0;0;2;2.7777777778;97.2222222222;0;97.2222222222;2.7777777778;75;0;25;3.7037037037;0;96.2962962963;100;0;0.0298507463;0.1293532338;0.07960199;0.039800995;0.0248756219;0.1194029851;0.0348258706;0.1741293532;0;0;0.1393034826;0.0298507463;0.0049751244;0.0149253731;0.0099502488;0.1641791045;0.0099502488;0;0;1;1;0;0;0;0.1044776119;0.1044776119;0.0895522388;0;0.0099502488;0;0.0199004975;0;0;19;0.0945273632;9;0.0447761194;0.3;3.8709877451;3.7363100885;0.9593137255;0.0170619473;2.9509803922;3.0368127643;2;0;0;0;2;0;0;2;0;0;0;0;0;0;0;0;0;0;0;0;0;0;2;2;0;0;0;1;0;0;1;0;0;0;0;0;0;0;0;0;0;0;0;0;0;1;-0.015;-0.015;0.9655172414;0;0;0.0172413793;0;0;0;0;0;0;0.0086206897;0;0;0;0;0;0;0.0086206897;0;0;0;0;0;0;0;1;1;0;0;0;0;3;3;2;2;1;1;2;2;0.0298507463;0.0298507463;0;0;0;0;0;0;0;0;0;0;0;0;0;2;2;0;0;;;;;;;;;;;;;;;;;;;;;;;;;;;;;;;;;;;;;;;;;;;;;;;;;;;;;;;;;;;;;;;;;;;;;;;;;;;;;;;;;1;56;2.9463414634;0.8388308169;2.5303531205;0.9756097561;2.8920880428;0;0;1;1;1;1;0;0;0;0;9;9;1;1;2;2;11;11;4;4;0;0
